{
  "id": "ga4gh:SQ.bcXSOLv4TaKocnaHlHdoyFiFIHNWYxt7",
  "type": "SequenceReference",
  "name": "NP_061330.2",
  "aliases": [
    "ensembl:ENSP00000005260.8",
    "ga4gh:SQ.bcXSOLv4TaKocnaHlHdoyFiFIHNWYxt7",
    "refseq:NP_061330.2"
  ],
  "description": "The protein product of the MANE Select coding transcript for BAIAP2L1 (refseq:NM_018842.5), corresponding to the Refseq protein accession NP_061330.2.",
  "moleculeType": "protein",
  "refgetAccession": "SQ.bcXSOLv4TaKocnaHlHdoyFiFIHNWYxt7",
  "residueAlphabet": "aa"
}