{
  "id": "ga4gh:SQ.GMP4RuPu7Q_irnmwoRIbnsFiecXnnHlw",
  "type": "SequenceReference",
  "name": "NP_478123.1",
  "aliases": [
    "ensembl:ENSP00000336701.4",
    "ga4gh:SQ.GMP4RuPu7Q_irnmwoRIbnsFiecXnnHlw",
    "refseq:NP_478123.1"
  ],
  "description": "The protein product of the MANE Select coding transcript for RAD51C (refseq:NM_058216.3), corresponding to the Refseq protein accession NP_478123.1.",
  "moleculeType": "protein",
  "refgetAccession": "SQ.GMP4RuPu7Q_irnmwoRIbnsFiecXnnHlw",
  "residueAlphabet": "aa"
}