{
  "id": "ga4gh:SQ.7B7SHsmchAR0dFcDCuSFjJAo7tX87krQ",
  "type": "SequenceReference",
  "name": "NC_000022.11",
  "aliases": [
    "ga4gh:SQ.7B7SHsmchAR0dFcDCuSFjJAo7tX87krQ",
    "refseq:NC_000022.11"
  ],
  "description": "GRCh38 chromosome 22 (RefSeq NC_000022.11).",
  "moleculeType": "genomic",
  "refgetAccession": "SQ.7B7SHsmchAR0dFcDCuSFjJAo7tX87krQ",
  "residueAlphabet": "na"
}